{
  "schemaVersion": "1.0.0",
  "id": "fnd_checkout_primary_button_spacing",
  "fingerprintCandidate": "visual-fidelity|visual.spacing|scn_checkout_default|checkout.primary-button",
  "fingerprintVersion": "1",
  "identityComponents": {
    "moduleId": "visual-fidelity",
    "ruleOrCategoryKey": "visual.spacing",
    "scenarioId": "scn_checkout_default",
    "anchorType": "element",
    "subjectKey": "checkout.primary-button",
    "variantId": null
  },
  "projectId": "prj_local_default",
  "moduleId": "visual-fidelity",
  "ruleId": "visual.spacing",
  "category": "visual.spacing",
  "conclusionType": "spec-mismatch",
  "subject": {
    "scenarioId": "scn_checkout_default",
    "anchorType": "element",
    "key": "checkout.primary-button",
    "label": "提交订单按钮",
    "componentRef": null
  },
  "title": "提交按钮左侧间距偏大",
  "summary": "实现截图中的提交按钮相对设计稿向右偏移 8 px。",
  "severity": "moderate",
  "severitySource": "engine",
  "priority": "p2",
  "prioritySource": "human",
  "resolutionStatus": "not-applicable",
  "verificationStatus": "not-requested",
  "revision": 1,
  "firstSeenRunId": "run_20260826_001",
  "lastSeenRunId": "run_20260826_001",
  "latestOccurrenceId": "occ_20260826_001_spacing_01",
  "recommendation": "将提交按钮容器的左侧间距调整为设计稿值。",
  "acceptanceCriteria": "在 1440×900、DPR 1 的截图中，左侧间距与设计稿误差不超过 1 px。",
  "reviewNote": "结算页本周发布，纳入当前修复批次。",
  "relatedFindingIds": [],
  "createdAt": "2026-08-26T10:00:00+08:00",
  "updatedAt": "2026-08-26T10:08:00+08:00"
}
